{"$schema":"https://artemsemdev.github.io/SeaRise-Europe/contracts/release/v1/build-receipt.schema.json","buildId":"build-phase-0r-c2ed9074624c","buildMode":"offline","codeRevision":"c2ed9074624c7cfe61bf610a1a67f4303aca7580","completedAt":"2026-08-06T15:04:00Z","dataProvenanceClass":"synthetic-fixture","dataReleaseId":"searise-europe-v1.0.0-20260810-c096aeab4e09","environment":{"architecture":"arm64","lock":{"path":"src/pipeline/requirements-release-macos-arm64.lock","sha256":"87880ce239f89f7b44e1165794dced3825d4fd9c3a6d413337d9f96530d50b75"},"platform":"darwin","pythonVersion":"3.11.9"},"inputs":[{"path":"source/ar6-regional-confidence.zip","sha256":"d3b1c2ed093cca491db2461e67b782bcca98763d326378ffee39908c2b094e91"}],"networkAccess":"disabled","outputs":[{"byteSize":251231,"mediaType":"application/vnd.apache.parquet","path":"analysis/projections.parquet","role":"projection-geoparquet","sha256":"d32d6a1ec14161f71f76f68e056844c3b07fafde24e92a92ee22a2d5080888d5"},{"byteSize":18623,"mediaType":"image/tiff; application=geotiff; profile=cloud-optimized","path":"analysis/ssp1-26/2030.tif","role":"projection-analysis-cog","sha256":"03cc14d33cc75535ce8fdd83e3e2636e4203c8d828a723e254dfa4cb90b0e6d6"},{"byteSize":20137,"mediaType":"image/tiff; application=geotiff; profile=cloud-optimized","path":"analysis/ssp1-26/2050.tif","role":"projection-analysis-cog","sha256":"87030c7e7d0c3481353a06507dab4acc93d0b2fc3a3482b34b607ce6bc891831"},{"byteSize":22143,"mediaType":"image/tiff; application=geotiff; profile=cloud-optimized","path":"analysis/ssp1-26/2100.tif","role":"projection-analysis-cog","sha256":"554799b56ef3abbff2c5c42f9033860f06d2fa8f025d6c4f6518b8e2d14a90c4"},{"byteSize":18778,"mediaType":"image/tiff; application=geotiff; profile=cloud-optimized","path":"analysis/ssp2-45/2030.tif","role":"projection-analysis-cog","sha256":"b087b052c77fddfbb7add3634a1c6a3f6ac384d5652e18c67e2e3105c292d12c"},{"byteSize":20320,"mediaType":"image/tiff; application=geotiff; profile=cloud-optimized","path":"analysis/ssp2-45/2050.tif","role":"projection-analysis-cog","sha256":"d7998337ead737320cba98772284c7e7ee9372573f65e72f100071f38b90391f"},{"byteSize":22333,"mediaType":"image/tiff; application=geotiff; profile=cloud-optimized","path":"analysis/ssp2-45/2100.tif","role":"projection-analysis-cog","sha256":"423570ce5d8d862e65b050e901c3f206bc5dad67b7477290e717afde09116adf"},{"byteSize":19045,"mediaType":"image/tiff; application=geotiff; profile=cloud-optimized","path":"analysis/ssp5-85/2030.tif","role":"projection-analysis-cog","sha256":"a5b5f6eb410e989016b946bc89bbe22fde5ea220add5a5430bf96ea1d5182a52"},{"byteSize":20568,"mediaType":"image/tiff; application=geotiff; profile=cloud-optimized","path":"analysis/ssp5-85/2050.tif","role":"projection-analysis-cog","sha256":"cc91888b39f42b0e23827d50e0d99c94cb56553d6f318fc374838513fd546310"},{"byteSize":22452,"mediaType":"image/tiff; application=geotiff; profile=cloud-optimized","path":"analysis/ssp5-85/2100.tif","role":"projection-analysis-cog","sha256":"4695e3d482a14c4e7e4e8c02631e9909547d714adb2ba7813a45454182239d80"},{"byteSize":667750,"mediaType":"application/vnd.apache.parquet","path":"boundaries/coastal-analysis-zone.parquet","role":"coastal-boundary","sha256":"3ba4d5eaba24d1202482bc33fd64fde8ce54b7ff1dd1456990d3c8cfece43366"},{"byteSize":267676,"mediaType":"application/vnd.apache.parquet","path":"boundaries/europe.parquet","role":"support-boundary","sha256":"531c6042a33cf3be9bc3ea340b0e557cb66bafb34de7954db0d7e47be90d35a9"},{"byteSize":586933,"mediaType":"application/vnd.pmtiles","path":"layers/ssp1-26/2030.pmtiles","role":"projection-visual-pmtiles","sha256":"51755e45ccfcb11f9b151358616d2b9769665b934702944da7dc2e52202e5dff"},{"byteSize":621823,"mediaType":"application/vnd.pmtiles","path":"layers/ssp1-26/2050.pmtiles","role":"projection-visual-pmtiles","sha256":"c5f7fcdbf56536d9f66eefdcea06ed7ec2952515b2c10e785651f66013048f24"},{"byteSize":665538,"mediaType":"application/vnd.pmtiles","path":"layers/ssp1-26/2100.pmtiles","role":"projection-visual-pmtiles","sha256":"8e3a84892c1d89c72275728efcaed63443085705ae4fd53bc154dc0a3c25e641"},{"byteSize":587387,"mediaType":"application/vnd.pmtiles","path":"layers/ssp2-45/2030.pmtiles","role":"projection-visual-pmtiles","sha256":"a83953a12c29b4e9a87133d8af58d2f74ff8ba2c52d9823fc10a4b69636e3fa8"},{"byteSize":624674,"mediaType":"application/vnd.pmtiles","path":"layers/ssp2-45/2050.pmtiles","role":"projection-visual-pmtiles","sha256":"8de5613f8af55e01f0a9cb61718803a5bb2f56aca043859faf032829da573126"},{"byteSize":670481,"mediaType":"application/vnd.pmtiles","path":"layers/ssp2-45/2100.pmtiles","role":"projection-visual-pmtiles","sha256":"bb54f780bca7778b0d0591e5af135312dbd992edf6d14d9a6117bd5d0810dc2d"},{"byteSize":590810,"mediaType":"application/vnd.pmtiles","path":"layers/ssp5-85/2030.pmtiles","role":"projection-visual-pmtiles","sha256":"5538829ae080402d4fe5cafa90fd8aa6ee8ac9f21669251ce66d14b7a4f84a72"},{"byteSize":627003,"mediaType":"application/vnd.pmtiles","path":"layers/ssp5-85/2050.pmtiles","role":"projection-visual-pmtiles","sha256":"7545146a7e8f481667d7a4130b20dbc397c11a55e3a357e102c70ded5a12cb63"},{"byteSize":681871,"mediaType":"application/vnd.pmtiles","path":"layers/ssp5-85/2100.pmtiles","role":"projection-visual-pmtiles","sha256":"3e68bcfdc4e891b05c77893d9a034795981bde72fe7056584678da8160e15b49"}],"parametersSha256":"8cb5afc91c524ae6b1ea9052ee13dd615dbb3f103e5364b5adfd3444df1b62da","reproducibilityComparison":{"excludedVolatileFields":["startedAt","completedAt"],"identityFields":["dataReleaseId","codeRevision","environment.lock.sha256","tools","sourceReceipts","inputs","parametersSha256","outputs"]},"schemaVersion":"1.0.0","sourceReceipts":[{"path":"receipts/sources/ipcc-ar6.json","sha256":"1e21b533e27324dc56b92343da6962d0b913af23a952c3802cbf9009a56e1ff8"}],"startedAt":"2026-08-06T14:58:54Z","tools":[{"identitySha256":"89ae72a90abdee9b97b8e4fdbb949c50cb0b0fb1d44c28cf7f54bc02b094e455","name":"searise-pipeline","version":"0.1.0"},{"identitySha256":"ef2b87f55ffe31296a436b2bcdaf3a68fa63f2a5ee1c9ce22ec36853c4f442ce","name":"tippecanoe","version":"2.79.0"},{"identitySha256":"40528f7f616fcbf91207cd48c8fc023d213f6d86c0cbf1f748732803d1880f3d","name":"pmtiles","version":"1.31.2"}]}
